{
  "target": {
    "entryId": "01JAB4M9ZQ7X3K2V8N5T6R1W0C"
  },
  "baseRev": "01JAC6ZK3D4F5G6H7J8K9M0N1P",
  "title": "Hot Tub Repair for Most Brands",
  "layout": [
    {
      "_type": "page_hero",
      "_key": "page_hero_a1",
      "heading": "Hot Tub Repair for Most Brands",
      "intro": "Not heating or tripping the breaker? We diagnose and fix most spa brands.",
      "_version": 1
    },
    {
      "_type": "faq",
      "_key": "faq_b2",
      "heading": "Hot tub repair questions",
      "items": [
        {
          "question": "Why is my hot tub not heating?",
          "answer": "Most often a failed heater element, a tripped high-limit switch or low flow."
        }
      ]
    },
    {
      "_type": "related_links",
      "_key": "related_links_c3",
      "heading": "Related services",
      "links": [
        {
          "label": "Spa services",
          "url": "/spa-services/"
        }
      ]
    }
  ],
  "seo": {
    "title": "Hot Tub Repair in Waukesha & Milwaukee | Oasis Pool and Spa",
    "description": "Hot tub not heating? Oasis repairs most spa brands across Waukesha and Milwaukee.",
    "noIndex": false
  },
  "actor": {
    "kind": "human",
    "osUserId": "8f14e45f-ceea-467a-9575-5f3c1b2a7d90",
    "name": "Jane PM",
    "role": "PM"
  }
}
